{
  "version": "1.0.0",
  "project": "Agyke",
  "last_updated": "2026-10-16T08:35:00-03:00",
  "active_sprint": "Fase 10 - Analítica Mensual, Command Center y Desacople del Muro (UI-32 a UI-37)",
  "summary": {
    "total": 67,
    "done": 53,
    "in_progress": 0,
    "pending": 10,
    "backlog": 4
  },
  "tasks": [
    {
      "id": "CORE-01",
      "title": "Estructura del Proyecto y Supabase Setup",
      "domain": "core",
      "status": "done",
      "priority": "p0",
      "spec_reference": "docs/TASKS.md#tarea-1",
      "dependencies": [],
      "acceptance_criteria": [
        "Configurar Node.js con TypeScript estricto y ESM",
        "Conectar cliente Supabase con SUPABASE_URL y SERVICE_ROLE_KEY",
        "Crear interfaces de base de datos en src/types/database.ts"
      ],
      "files_to_touch": ["src/lib/supabase.ts", "src/types/database.ts", "package.json"],
      "completed_at": "2026-07-28T09:30:00Z"
    },
    {
      "id": "CORE-02",
      "title": "Inicialización del Bot y Middleware de Autenticación",
      "domain": "bot",
      "status": "done",
      "priority": "p0",
      "spec_reference": "docs/TASKS.md#tarea-2",
      "dependencies": ["CORE-01"],
      "acceptance_criteria": [
        "Instanciar grammY Bot desacoplado de polling",
        "Auto-registro de usuarios en tabla users ante comando /start",
        "Middleware de autenticación de Telegram ID"
      ],
      "files_to_touch": ["src/bot/index.ts", "src/bot/middlewares/auth.ts"],
      "completed_at": "2026-07-28T10:15:00Z"
    },
    {
      "id": "CORE-03",
      "title": "Handler de Carga Directa /gasto",
      "domain": "bot",
      "status": "done",
      "priority": "p0",
      "spec_reference": "docs/TASKS.md#tarea-3",
      "dependencies": ["CORE-02"],
      "acceptance_criteria": [
        "Parsear argumentos /gasto <monto> <concepto> <clasif>",
        "Validar clasificación permitida ('50', '100', '-100', '0')",
        "Actualizar net_balance en tabla balances atómicamente"
      ],
      "files_to_touch": ["src/bot/commands/gasto.ts", "src/services/balance.ts"],
      "completed_at": "2026-07-28T11:00:00Z"
    },
    {
      "id": "CORE-04",
      "title": "Pipeline Asistido con Gemini 1.5 Flash",
      "domain": "bot",
      "status": "done",
      "priority": "p0",
      "spec_reference": "docs/TASKS.md#tarea-4",
      "dependencies": ["CORE-03"],
      "acceptance_criteria": [
        "Integrar SDK @google/generative-ai con modelo gemini-1.5-flash",
        "Extraer monto y concepto estructurados de mensajes libres",
        "Insertar en agyke_queue con estado PENDING y enviar teclado inline"
      ],
      "files_to_touch": ["src/services/gemini.ts", "src/bot/handlers/assisted.ts"],
      "completed_at": "2026-07-28T12:30:00Z"
    },
    {
      "id": "CORE-05",
      "title": "Handler de Botones Agyke (Inline Keyboards)",
      "domain": "bot",
      "status": "done",
      "priority": "p0",
      "spec_reference": "docs/TASKS.md#tarea-5",
      "dependencies": ["CORE-04"],
      "acceptance_criteria": [
        "Listener callback_query para botones '50', '100', '-100', '0'",
        "Consumir agyke_queue y persistir en transactions",
        "Disparar updateBalance() y editar mensaje original"
      ],
      "files_to_touch": ["src/bot/handlers/callback.ts", "src/services/balance.ts"],
      "completed_at": "2026-07-28T13:45:00Z"
    },
    {
      "id": "CORE-06",
      "title": "Dashboard Web en Next.js 16",
      "domain": "web",
      "status": "done",
      "priority": "p1",
      "spec_reference": "docs/TASKS.md#tarea-6",
      "dependencies": ["CORE-05"],
      "acceptance_criteria": [
        "App Router en carpeta web/",
        "Lectura de transacciones y balances desde Supabase",
        "Gráficos analíticos Recharts y visualización de balance"
      ],
      "files_to_touch": ["web/src/app/page.tsx", "web/src/app/api/dashboard/route.ts"],
      "completed_at": "2026-07-28T15:00:00Z"
    },
    {
      "id": "CORE-07",
      "title": "Arnés de Simulación Headless de Telegram",
      "domain": "devops",
      "status": "done",
      "priority": "p0",
      "spec_reference": "docs/LOCAL_TESTING_SPEC.md",
      "dependencies": ["CORE-05"],
      "acceptance_criteria": [
        "Crear generador de Updates sintéticos de Telegram",
        "Tests de integración simulando comandos y callbacks",
        "Script npm run test:integration funcionando sin bot en vivo"
      ],
      "files_to_touch": ["src/tests/telegram-mock.ts", "src/tests/integration.test.ts"],
      "completed_at": "2026-09-24T09:00:00Z"
    },
    {
      "id": "CORE-08",
      "title": "Entorno de Pruebas Local Completo (Simulate CLI)",
      "domain": "devops",
      "status": "done",
      "priority": "p1",
      "spec_reference": "docs/TASKS.md#tarea-8",
      "dependencies": ["CORE-07"],
      "acceptance_criteria": [
        "Script interactivo scripts/simulate-flow.ts",
        "Formato visual con emojis y pasos contables en consola",
        "Suite npm test con 26/26 tests en verde"
      ],
      "files_to_touch": ["scripts/simulate-flow.ts", "package.json"],
      "completed_at": "2026-09-24T11:30:00Z"
    },
    {
      "id": "CORE-09",
      "title": "Preparación y Validación de Deploy Serverless a Producción",
      "domain": "devops",
      "status": "done",
      "priority": "p0",
      "spec_reference": "docs/TASKS_PROD.md",
      "dependencies": ["CORE-06"],
      "acceptance_criteria": [
        "Desacoplar bot.start() y exportar bot en modo stateless",
        "Endpoint serverless /api/telegram/webhook con canUseWebhookReply: false",
        "Compilación exitosa con Webpack en Next.js 16 para Vercel"
      ],
      "files_to_touch": ["web/src/app/api/telegram/webhook/route.ts", "web/next.config.ts"],
      "completed_at": "2026-09-24T13:00:00Z"
    },
    {
      "id": "AUTH-01",
      "title": "Módulo Criptográfico HMAC-SHA256",
      "domain": "auth",
      "status": "done",
      "priority": "p0",
      "spec_reference": "docs/auth/AUTH_SPEC.md#seccion-4",
      "dependencies": ["CORE-06"],
      "acceptance_criteria": [
        "Crear src/lib/auth.ts alineado a rootDir",
        "Firmar tokens de sesión con HMAC-SHA256 y timestamp",
        "Verificar tokens rechazando expirados (>30 días) o manipulados"
      ],
      "files_to_touch": ["src/lib/auth.ts"],
      "completed_at": "2026-09-28T09:40:00Z"
    },
    {
      "id": "AUTH-02",
      "title": "Endpoint POST /api/auth/login con Cookie Segura",
      "domain": "auth",
      "status": "done",
      "priority": "p0",
      "spec_reference": "docs/auth/AUTH_SPEC.md#seccion-6",
      "dependencies": ["AUTH-01"],
      "acceptance_criteria": [
        "Validar PIN contra process.env.DASHBOARD_ACCESS_PIN",
        "Setear cookie agyke_session (httpOnly, Secure, SameSite=Lax, Max-Age 30 días)",
        "Retornar 401 ante PIN inválido"
      ],
      "files_to_touch": ["web/src/app/api/auth/login/route.ts"],
      "completed_at": "2026-09-28T09:45:00Z"
    },
    {
      "id": "AUTH-03",
      "title": "Endpoint POST /api/auth/logout para Cierre de Sesión",
      "domain": "auth",
      "status": "done",
      "priority": "p1",
      "spec_reference": "docs/auth/AUTH_SPEC.md#seccion-6",
      "dependencies": ["AUTH-02"],
      "acceptance_criteria": [
        "Limpiar cookie agyke_session seteando Max-Age=0",
        "Responder 200 OK con confirmación"
      ],
      "files_to_touch": ["web/src/app/api/auth/logout/route.ts"],
      "completed_at": "2026-09-28T09:47:00Z"
    },
    {
      "id": "AUTH-04",
      "title": "Next.js Middleware de Protección de Rutas",
      "domain": "auth",
      "status": "done",
      "priority": "p0",
      "spec_reference": "docs/auth/AUTH_SPEC.md#seccion-5",
      "dependencies": ["AUTH-02"],
      "acceptance_criteria": [
        "Interceptar rutas / y /api/dashboard",
        "Bypass estricto para /login, /api/auth/* y /api/telegram/webhook",
        "Redirección 307 a /login ante falta de sesión"
      ],
      "files_to_touch": ["web/src/middleware.ts"],
      "completed_at": "2026-09-28T09:50:00Z"
    },
    {
      "id": "AUTH-05",
      "title": "Pantalla de Login /login estilo Obsidian Slate",
      "domain": "auth",
      "status": "done",
      "priority": "p1",
      "spec_reference": "docs/auth/AUTH_SPEC.md#seccion-7",
      "dependencies": ["AUTH-04"],
      "acceptance_criteria": [
        "Tarjeta glassmorphism centrada con isotipo de balanza",
        "Input de contraseña con botón mostrar/ocultar y validación reactiva",
        "Redirección suave al Dashboard principal tras autenticación exitosa"
      ],
      "files_to_touch": ["web/src/app/login/page.tsx", "web/src/app/login/layout.tsx"],
      "completed_at": "2026-09-28T09:55:00Z"
    },
    {
      "id": "AUTH-06",
      "title": "Botón de Bloqueo Manual en HeaderBar",
      "domain": "auth",
      "status": "done",
      "priority": "p2",
      "spec_reference": "docs/auth/AUTH_SPEC.md#seccion-7",
      "dependencies": ["AUTH-05"],
      "acceptance_criteria": [
        "Icono Lock en barra superior para invocar /api/auth/logout",
        "Redirección automática a /login al cerrar sesión"
      ],
      "files_to_touch": ["web/src/components/HeaderBar.tsx"],
      "completed_at": "2026-09-28T09:57:00Z"
    },
    {
      "id": "AUTH-07",
      "title": "Tests Automatizados de Validación de PIN y Sesión HMAC",
      "domain": "auth",
      "status": "done",
      "priority": "p0",
      "spec_reference": "docs/auth/TASKS_AUTH.md#fase-4",
      "dependencies": ["AUTH-01"],
      "acceptance_criteria": [
        "Suite src/tests/auth.test.ts con 5 tests unitarios",
        "Validar tokens manipulados, expirados y firma válida"
      ],
      "files_to_touch": ["src/tests/auth.test.ts"],
      "completed_at": "2026-09-28T10:05:00Z"
    },
    {
      "id": "AUTH-08",
      "title": "Verificación de Bypass Serverless para Webhook de Telegram",